{
  "schemaVersion": 2,
  "id": "visual.wizard.production",
  "style": "stylized",
  "seed": 73412,
  "identity": {
    "description": "A veteran human battle mage in blue layered robes, carrying a carved staff with a luminous crystal focus.",
    "silhouette": "Broad robed torso, compact limbs, swept white hair and a tall staff held beside the body.",
    "paletteRoles": ["skin", "cloth", "leather", "wood", "crystal", "accent"],
    "focalFeatures": ["white swept hair", "blue rune robes", "crystal battle staff"]
  },
  "outputs": [
    {
      "id": "gameplay-3d",
      "mode": "3d",
      "profile": "stylized-pbr-3d",
      "quality": "production",
      "source": {
        "kind": "rigged-gltf",
        "path": "sources/3d/wizard.gltf",
        "provenance": {
          "origin": "Quaternius RPG Character Pack — Wizard.gltf; https://quaternius.com/packs/rpgcharacters.html",
          "license": "CC0-1.0",
          "sha256": "320de17289857db6794e4eef55101ce3427e755319a4384fb6d9d9ca5206b41b"
        }
      },
      "requirements": {
        "minimumAnimations": 8,
        "requiredAnimations": ["idle", "walk", "run", "staff-attack"],
        "maximumTriangles": 25000,
        "minimumTextureSize": 512,
        "lods": 1
      }
    }
  ]
}
